[
  {
    "title": "The Genotype-Tissue Expression (GTEx) project v8",
    "accession": "E-GTEX-8",
    "description": "",
    "pubmedid": "35922509",
    "data_source": "Expression_Atlas",
    "last_updated": "2025-09-23T15:25:47.124153",
    "update_frequency": "static",
    "organism": "Homo sapiens",
    "expression_unit": "TPM",
    "platform_type": "RNA-seq",
    "data_level": "transcript",
    "files": [
      {
        "path": "E-GTEX-8.condensed-sdrf.tsv",
        "format": "tsv",
        "size_bytes": 0,
        "description": "File type: sdrf"
      },
      {
        "path": "E-GTEX-8-transcripts-tpms.tsv",
        "format": "tsv",
        "size_bytes": 0,
        "description": "File type: transcript-tpm"
      }
    ]
  },
  {
    "title": "Human RNA-seq time-series of the development of seven major organs",
    "accession": "E-MTAB-6814",
    "description": "This dataset covers the development of 7 organs (brain, cerebellum, heart, kidney, liver, ovary and testis) from 4 weeks post conception to adulthood (including ageing).",
    "pubmedid": "31243369",
    "data_source": "Expression_Atlas",
    "last_updated": "2025-09-23T15:25:47.128465",
    "update_frequency": "static",
    "organism": "Homo sapiens",
    "expression_unit": "TPM",
    "platform_type": "RNA-seq",
    "data_level": "transcript",
    "files": [
      {
        "path": "E-MTAB-6814.condensed-sdrf.tsv",
        "format": "tsv",
        "size_bytes": 0,
        "description": "File type: sdrf"
      },
      {
        "path": "E-MTAB-6814-transcripts-tpms.tsv",
        "format": "tsv",
        "size_bytes": 0,
        "description": "File type: transcript-tpm"
      }
    ]
  },
  {
    "title": "Chicken RNA-seq time-series of the development of seven major organs",
    "accession": "E-MTAB-6769",
    "description": "This dataset covers the development of 7 organs (brain, cerebellum, heart, kidney, liver, ovary and testis) from day 10 post-conception to day 155 post-hatch in Gallus gallus.",
    "pubmedid": "31243369",
    "data_source": "Expression_Atlas",
    "last_updated": "2025-09-23T15:25:47.132344",
    "update_frequency": "static",
    "organism": "Homo sapiens",
    "expression_unit": "TPM",
    "platform_type": "RNA-seq",
    "data_level": "transcript",
    "files": [
      {
        "path": "E-MTAB-6769.condensed-sdrf.tsv",
        "format": "tsv",
        "size_bytes": 0,
        "description": "File type: sdrf"
      },
      {
        "path": "E-MTAB-6769-transcripts-tpms.tsv",
        "format": "tsv",
        "size_bytes": 0,
        "description": "File type: transcript-tpm"
      }
    ]
  },
  {
    "title": "Opossum RNA-seq time-series of the development of seven major organs",
    "accession": "E-MTAB-6833",
    "description": "This dataset covers the development of 7 organs (brain, cerebellum, heart, kidney, liver, ovary and testis) from embryonic day 13.5 to adulthood in Monodelphis domestica.",
    "pubmedid": "31243369",
    "data_source": "Expression_Atlas",
    "last_updated": "2025-09-23T15:25:47.136119",
    "update_frequency": "static",
    "organism": "Homo sapiens",
    "expression_unit": "TPM",
    "platform_type": "RNA-seq",
    "data_level": "transcript",
    "files": [
      {
        "path": "E-MTAB-6833.condensed-sdrf.tsv",
        "format": "tsv",
        "size_bytes": 0,
        "description": "File type: sdrf"
      },
      {
        "path": "E-MTAB-6833-transcripts-tpms.tsv",
        "format": "tsv",
        "size_bytes": 0,
        "description": "File type: transcript-tpm"
      }
    ]
  },
  {
    "title": "Mouse RNA-seq time-series of the development of seven major organs",
    "accession": "E-MTAB-6798",
    "description": "This dataset covers the development of 7 organs (brain, cerebellum, heart, kidney, liver, ovary and testis) from embryonic day 10.5 to adulthood in Mus musculus.",
    "pubmedid": "31243369",
    "data_source": "Expression_Atlas",
    "last_updated": "2025-09-23T15:25:47.139828",
    "update_frequency": "static",
    "organism": "Mus musculus",
    "license": "CC BY 4.0",
    "expression_unit": "TPM",
    "platform_type": "RNA-seq",
    "data_level": "transcript",
    "files": [
      {
        "path": "E-MTAB-6798.condensed-sdrf.tsv",
        "format": "tsv",
        "size_bytes": 0,
        "description": "File type: sdrf"
      },
      {
        "path": "E-MTAB-6798-transcripts-tpms.tsv",
        "format": "tsv",
        "size_bytes": 0,
        "description": "File type: transcript-tpm"
      }
    ]
  },
  {
    "title": "Rabbit RNA-seq time-series of the development of seven major organs",
    "accession": "E-MTAB-6782",
    "description": "This dataset covers the development of 7 organs (brain, cerebellum, heart, kidney, liver, ovary and testis) from embryonic day 12 to adulthood in Oryctolagus cuniculus.",
    "pubmedid": "31243369",
    "data_source": "Expression_Atlas",
    "last_updated": "2025-09-23T15:25:47.143702",
    "update_frequency": "static",
    "organism": "Homo sapiens",
    "expression_unit": "TPM",
    "platform_type": "RNA-seq",
    "data_level": "transcript",
    "files": [
      {
        "path": "E-MTAB-6782.condensed-sdrf.tsv",
        "format": "tsv",
        "size_bytes": 0,
        "description": "File type: sdrf"
      },
      {
        "path": "E-MTAB-6782-transcripts-tpms.tsv",
        "format": "tsv",
        "size_bytes": 0,
        "description": "File type: transcript-tpm"
      }
    ]
  },
  {
    "title": "Rat RNA-seq time-series of the development of seven major organs",
    "accession": "E-MTAB-6811",
    "description": "This dataset covers the development of 7 organs (brain, cerebellum, heart, kidney, liver, ovary and testis) from embryonic day 11 to adulthood in Rattus norvegicus.",
    "pubmedid": "31243369",
    "data_source": "Expression_Atlas",
    "last_updated": "2025-09-23T15:25:47.147993",
    "update_frequency": "static",
    "organism": "Homo sapiens",
    "expression_unit": "TPM",
    "platform_type": "RNA-seq",
    "data_level": "transcript",
    "files": [
      {
        "path": "E-MTAB-6811.condensed-sdrf.tsv",
        "format": "tsv",
        "size_bytes": 0,
        "description": "File type: sdrf"
      },
      {
        "path": "E-MTAB-6811-transcripts-tpms.tsv",
        "format": "tsv",
        "size_bytes": 0,
        "description": "File type: transcript-tpm"
      }
    ]
  },
  {
    "title": "Human protein atlas - Normal tissue proteomics",
    "accession": "E-ERAD-475",
    "description": "Protein expression data from the Human Protein Atlas covering normal human tissues using mass spectrometry and immunohistochemistry approaches.",
    "pubmedid": "25613900",
    "data_source": "Expression_Atlas",
    "last_updated": "2025-09-23T15:25:47.152249",
    "update_frequency": "static",
    "organism": "Homo sapiens",
    "expression_unit": "TPM",
    "platform_type": "RNA-seq",
    "data_level": "transcript",
    "files": [
      {
        "path": "E-ERAD-475.condensed-sdrf.tsv",
        "format": "tsv",
        "size_bytes": 0,
        "description": "File type: sdrf"
      },
      {
        "path": "E-ERAD-475-protein-abundance.tsv",
        "format": "tsv",
        "size_bytes": 0,
        "description": "File type: protein-abundance"
      }
    ]
  },
  {
    "title": "RNA-seq of human individual tissues and mixture of tissues",
    "accession": "E-MTAB-2770",
    "description": "RNA sequencing of 95 human individuals representing 27 different tissues to study tissue-specific gene expression patterns and individual variation.",
    "pubmedid": "24705247",
    "data_source": "Expression_Atlas",
    "last_updated": "2025-09-23T15:25:47.156033",
    "update_frequency": "static",
    "organism": "Homo sapiens",
    "expression_unit": "TPM",
    "platform_type": "RNA-seq",
    "data_level": "transcript",
    "files": [
      {
        "path": "E-MTAB-2770.condensed-sdrf.tsv",
        "format": "tsv",
        "size_bytes": 0,
        "description": "File type: sdrf"
      },
      {
        "path": "E-MTAB-2770-transcripts-tpms.tsv",
        "format": "tsv",
        "size_bytes": 0,
        "description": "File type: transcript-tpm"
      }
    ]
  },
  {
    "title": "RNA-seq of mouse tissues",
    "accession": "E-MTAB-2706",
    "description": "RNA sequencing analysis of multiple mouse tissues to characterize baseline gene expression patterns across different organ systems in Mus musculus.",
    "pubmedid": "24705247",
    "data_source": "Expression_Atlas",
    "last_updated": "2025-09-23T15:25:47.163779",
    "update_frequency": "static",
    "organism": "Homo sapiens",
    "expression_unit": "TPM",
    "platform_type": "RNA-seq",
    "data_level": "transcript",
    "files": [
      {
        "path": "E-MTAB-2706.condensed-sdrf.tsv",
        "format": "tsv",
        "size_bytes": 0,
        "description": "File type: sdrf"
      },
      {
        "path": "E-MTAB-2706-transcripts-tpms.tsv",
        "format": "tsv",
        "size_bytes": 0,
        "description": "File type: transcript-tpm"
      }
    ]
  },
  {
    "title": "Expression data from mouse tissues",
    "accession": "E-GEOD-5615",
    "description": "Microarray gene expression profiling of various mouse tissues using Affymetrix arrays to establish baseline expression reference in Mus musculus.",
    "pubmedid": "17576787",
    "data_source": "Expression_Atlas",
    "last_updated": "2025-09-23T15:25:47.167595",
    "update_frequency": "static",
    "organism": "Homo sapiens",
    "expression_unit": "TPM",
    "platform_type": "microarray",
    "data_level": "transcript",
    "files": [
      {
        "path": "E-GEOD-5615.condensed-sdrf.tsv",
        "format": "tsv",
        "size_bytes": 0,
        "description": "File type: sdrf"
      },
      {
        "path": "E-GEOD-5615-transcripts-tpms.tsv",
        "format": "tsv",
        "size_bytes": 0,
        "description": "File type: transcript-tpm"
      }
    ]
  },
  {